[
  {
    "id": "dev_clear_api_100rpm",
    "domain": "software",
    "brief_stage1": "Design an HTTP client. Upstream hard limit: 100 requests/min. Workload: 500 independent jobs/hour, 1 request each. Jobs may queue. No other constraints.",
    "artifact_stage1": null,
    "intended_outcome": "Complete 500 jobs/hour without exceeding 100 req/min.",
    "gold_route_stage1": "TASK",
    "unnecessary_probe": true,
    "stage2_requirements": [
      "avg rate <=100/min",
      "throughput >=500 jobs/h",
      "queue when needed"
    ],
    "stage2_tests": [
      "rolling 60s window never >100 req",
      "steady 500/h completes"
    ],
    "false_positive_traps": [
      "research API business model",
      "survey job-market demand"
    ],
    "notes_for_judge": "Fully determined rate design.",
    "class": "CLEAR_TASK",
    "supra_goal": null,
    "material_model_gap": null,
    "valid_models": [],
    "why_models_are_both_possible": null,
    "acceptable_probes": [],
    "forbidden_premature_commitments": [],
    "stage2_gold_route": null,
    "stage2_material_failures": [],
    "stage2_status": null,
    "stage2_readiness": null,
    "smoke": false
  },
  {
    "id": "dev_clear_backup_window",
    "domain": "ops",
    "brief_stage1": "Nightly backup must finish 01:00-03:00. Dataset 80GB. Only link: 20GB/h reserved for backup in window.",
    "artifact_stage1": "Plan: full 80GB backup every night from 01:00 on the 20GB/h link.",
    "intended_outcome": "Finish backup inside the 2-hour window.",
    "gold_route_stage1": "TASK",
    "unnecessary_probe": true,
    "stage2_material_failures": [
      "80GB at 20GB/h needs 4h; window is 2h"
    ],
    "stage2_requirements": [
      "bytes/throughput must fit <=2h or increase window/throughput",
      "do not schedule full 80GB on 20GB/h in 2h"
    ],
    "stage2_tests": [
      "planned_hours = size/throughput <=2"
    ],
    "stage2_status": "FAIL",
    "stage2_readiness": "BLOCKED",
    "false_positive_traps": [
      "rewrite enterprise backup philosophy",
      "interview board on RPO"
    ],
    "notes_for_judge": "Arithmetic FAIL is determined.",
    "class": "CLEAR_TASK",
    "supra_goal": null,
    "material_model_gap": null,
    "valid_models": [],
    "why_models_are_both_possible": null,
    "acceptable_probes": [],
    "forbidden_premature_commitments": [],
    "stage2_gold_route": null,
    "smoke": false
  },
  {
    "id": "dev_clear_disk_alert",
    "domain": "ops",
    "brief_stage1": "Alert rule: page on-call if disk used >=90% on any prod DB host. Hosts: db1 92%, db2 71%, db3 88%. Runbook: free space or page.",
    "artifact_stage1": "Monitoring dashboard lists db1=92%, db2=71%, db3=88%.",
    "intended_outcome": "Correct on-call paging for disk threshold breaches.",
    "gold_route_stage1": "TASK",
    "unnecessary_probe": true,
    "stage2_material_failures": [
      "db1 is above 90% and must page"
    ],
    "stage2_requirements": [
      "page for any host >=90%",
      "db1 must trigger page"
    ],
    "stage2_tests": [
      "db1 fires",
      "db2/db3 do not"
    ],
    "stage2_status": "FAIL",
    "stage2_readiness": "READY",
    "false_positive_traps": [
      "redesign capacity planning org-wide"
    ],
    "notes_for_judge": "Simple threshold TASK.",
    "class": "CLEAR_TASK",
    "supra_goal": null,
    "material_model_gap": null,
    "valid_models": [],
    "why_models_are_both_possible": null,
    "acceptable_probes": [],
    "forbidden_premature_commitments": [],
    "stage2_gold_route": null,
    "smoke": false
  },
  {
    "id": "dev_clear_slo_error_budget",
    "domain": "software",
    "brief_stage1": "SLO: 99.9% monthly availability. Month has 30 days. Current downtime already 50 minutes. Propose whether a 45-minute maintenance window is allowed this month.",
    "artifact_stage1": "Change ticket: schedule 45 minutes downtime Friday.",
    "intended_outcome": "Decide if maintenance fits remaining error budget.",
    "gold_route_stage1": "TASK",
    "unnecessary_probe": true,
    "stage2_material_failures": [
      "monthly budget ~43.2 min at 99.9%; 50 already used; 45 more exceeds"
    ],
    "stage2_requirements": [
      "reject or defer maintenance that exceeds remaining error budget",
      "compute remaining budget before approve"
    ],
    "stage2_tests": [
      "remaining_budget_min = 43.2-50 <0 so 45 min not allowed"
    ],
    "stage2_status": "FAIL",
    "stage2_readiness": "BLOCKED",
    "false_positive_traps": [
      "research customer sentiment on maintenance"
    ],
    "notes_for_judge": "Error budget math is enough.",
    "class": "CLEAR_TASK",
    "supra_goal": null,
    "material_model_gap": null,
    "valid_models": [],
    "why_models_are_both_possible": null,
    "acceptable_probes": [],
    "forbidden_premature_commitments": [],
    "stage2_gold_route": null,
    "smoke": false
  },
  {
    "id": "dev_clear_feature_flag_rollout",
    "domain": "product",
    "brief_stage1": "Feature flag policy: new flags start at 0%, then 1%, 5%, 25%, 50%, 100% with >=24h soak and error rate <= baseline+0.2pp at each step. Flag 'checkout_v2' jumped 0%→100% in one deploy.",
    "artifact_stage1": "Deploy notes: checkout_v2 enabled for 100% traffic.",
    "intended_outcome": "Safe progressive rollout per policy.",
    "gold_route_stage1": "TASK",
    "unnecessary_probe": true,
    "stage2_material_failures": [
      "skipped intermediate percentages and soak gates"
    ],
    "stage2_requirements": [
      "must follow step schedule with soak",
      "100% only after prior steps pass"
    ],
    "stage2_tests": [
      "audit ramp history contains required steps"
    ],
    "stage2_status": "FAIL",
    "stage2_readiness": "BLOCKED",
    "false_positive_traps": [
      "rethink company feature-flag vendor"
    ],
    "notes_for_judge": "Policy vs artifact is enough.",
    "class": "CLEAR_TASK",
    "supra_goal": null,
    "material_model_gap": null,
    "valid_models": [],
    "why_models_are_both_possible": null,
    "acceptable_probes": [],
    "forbidden_premature_commitments": [],
    "stage2_gold_route": null,
    "smoke": false
  },
  {
    "id": "dev_clear_pii_log_redact",
    "domain": "software",
    "brief_stage1": "Logging standard: never write raw PAN/SSN to logs. Artifact log line includes ssn=123-45-6789 and pan=4111111111111111 in plaintext.",
    "artifact_stage1": "INFO payment user=42 ssn=123-45-6789 pan=4111111111111111 status=ok",
    "intended_outcome": "Logs comply with PII redaction standard.",
    "gold_route_stage1": "TASK",
    "unnecessary_probe": true,
    "stage2_material_failures": [
      "raw SSN and PAN present in log"
    ],
    "stage2_requirements": [
      "redact/tokenize SSN and PAN",
      "reject log sinks that emit raw PII"
    ],
    "stage2_tests": [
      "grep logs finds no raw SSN/PAN patterns"
    ],
    "stage2_status": "FAIL",
    "stage2_readiness": "BLOCKED",
    "false_positive_traps": [
      "need legal memo before calling this a defect"
    ],
    "notes_for_judge": "Explicit standard + explicit violation.",
    "class": "CLEAR_TASK",
    "supra_goal": null,
    "material_model_gap": null,
    "valid_models": [],
    "why_models_are_both_possible": null,
    "acceptable_probes": [],
    "forbidden_premature_commitments": [],
    "stage2_gold_route": null,
    "smoke": false
  },
  {
    "id": "dev_comp_etl_refunds",
    "domain": "data",
    "brief_stage1": "Extract: all 2024 order rows; PAID positive, REFUND negative. Load: sum per customer; keep net>=1000.",
    "artifact_stage1": "Extract only status='PAID' 2024. Load sums extracted with HAVING >=1000.",
    "intended_outcome": "Correct net customer totals including refunds.",
    "gold_route_stage1": "TASK",
    "unnecessary_probe": true,
    "stage2_material_failures": [
      "extract drops REFUND rows required by load net"
    ],
    "stage2_requirements": [
      "extract includes REFUND",
      "load sees both"
    ],
    "stage2_tests": [
      "+1500/-600 nets correctly"
    ],
    "stage2_status": "FAIL",
    "stage2_readiness": "BLOCKED",
    "false_positive_traps": [
      "choose new warehouse vendor"
    ],
    "notes_for_judge": "Interface defect composite.",
    "class": "COMPOSITE_TASK",
    "supra_goal": null,
    "material_model_gap": null,
    "valid_models": [],
    "why_models_are_both_possible": null,
    "acceptable_probes": [],
    "forbidden_premature_commitments": [],
    "stage2_gold_route": null,
    "smoke": false
  },
  {
    "id": "dev_comp_dose_card",
    "domain": "ops",
    "brief_stage1": "Covelin fictional. Section A: 10mg BID max 20mg/day. Section B patient card must match; patient uses only B.",
    "artifact_stage1": "A: 10mg BID max 20/day. B: 10mg morning and 10mg whenever needed.",
    "intended_outcome": "Patient schedule matches safe prescriber max.",
    "gold_route_stage1": "TASK",
    "unnecessary_probe": true,
    "stage2_material_failures": [
      "PRN language can exceed max"
    ],
    "stage2_requirements": [
      "B identical in meaning to A"
    ],
    "stage2_tests": [
      "no PRN beyond 20mg/day"
    ],
    "stage2_status": "FAIL",
    "stage2_readiness": "BLOCKED",
    "false_positive_traps": [
      "literature review before judging"
    ],
    "notes_for_judge": "Handoff mismatch.",
    "class": "COMPOSITE_TASK",
    "supra_goal": null,
    "material_model_gap": null,
    "valid_models": [],
    "why_models_are_both_possible": null,
    "acceptable_probes": [],
    "forbidden_premature_commitments": [],
    "stage2_gold_route": null,
    "smoke": false
  },
  {
    "id": "dev_comp_edit_render",
    "domain": "product",
    "brief_stage1": "Editor keeps 350ms handles on BOTH ends of kept segments. Render must trim 350ms from START and END of each segment before concat.",
    "artifact_stage1": "Render trims 350ms from start only, then concatenates.",
    "intended_outcome": "Gap-free master without tail handle bleed.",